{
  "schema_version": "1.0.0",
  "facts_version": "1.0.0",
  "scenario_version": "1.3.0",
  "record_id": "google-4900e7d2e07f01a8847e",
  "provider": "google",
  "frozen_record_sha256": "4900e7d2e07f01a8847edf95b1c9468ed693895886e215060fe4c256a72a02c8",
  "frozen_title": "20 Bar Machine with Grinder Machine with Milk Frother",
  "resolution": {
    "status": "matched_listing",
    "token_overlap": 1.0,
    "reasons": [],
    "method": "title_and_merchant_search_candidate",
    "page_title": "20 Bar Automatic Espresso Coffee Machine with Milk Frother and Grinder - 17.3” x 7.4” x 12.5”",
    "product_url": "https://www.bedbathandbeyond.com/Home-Garden/20-Bar-Automatic-Espresso-Coffee-Machine-with-Milk-Frother-and-Grinder-17.3-x-7.4-x-12.5/43154746/product.html",
    "note": "Matched using product title and retained URL lineage or merchant-scoped search; not independently verified SKU identity."
  },
  "facts": [
    {
      "category": "brewing",
      "name": "advertised_pressure_bar",
      "value": "20",
      "evidence": [
        {
          "source_id": "src-e01a2bc213957048a8f29a3d",
          "locator": "page title"
        }
      ],
      "unit": "bar"
    },
    {
      "category": "grinding",
      "name": "grind_settings",
      "value": "15",
      "evidence": [
        {
          "source_id": "src-e01a2bc213957048a8f29a3d",
          "locator": "web text line 35"
        }
      ]
    },
    {
      "category": "grinding",
      "name": "integrated_grinder",
      "value": true,
      "evidence": [
        {
          "source_id": "src-e01a2bc213957048a8f29a3d",
          "locator": "web text line 40"
        }
      ]
    },
    {
      "category": "milk",
      "name": "automatic_frothing_explicit",
      "value": true,
      "evidence": [
        {
          "source_id": "src-e01a2bc213957048a8f29a3d",
          "locator": "web text line 40"
        }
      ]
    },
    {
      "category": "maintenance",
      "name": "self_cleaning_claim",
      "value": true,
      "evidence": [
        {
          "source_id": "src-e01a2bc213957048a8f29a3d",
          "locator": "web text line 40"
        }
      ]
    }
  ],
  "offer_observations": [],
  "conflicts": [],
  "not_established_categories": [
    "electrical",
    "included_items",
    "physical"
  ],
  "attempts": [
    {
      "method": "web.search title and merchant domain",
      "query": "20 Bar Machine with Grinder Machine with Milk Frother",
      "domain_filter": "bedbathandbeyond.com",
      "retrieved_at": "2026-09-13T10:42:07.768Z",
      "candidate_count": 12,
      "status": "URL discovery only; no search snippet treated as a fact"
    },
    {
      "url": "https://www.bedbathandbeyond.com/Home-Garden/20-Bar-Automatic-Espresso-Coffee-Machine-with-Milk-Frother-and-Grinder-17.3-x-7.4-x-12.5/43154746/product.html",
      "method": "HTTP GET",
      "retrieved_at": "2026-09-13T10:48:32.293364+00:00",
      "status": "unavailable",
      "error_type": "HTTPError"
    },
    {
      "url": "https://www.bedbathandbeyond.com/Home-Garden/20-Bar-Automatic-Espresso-Coffee-Machine-with-Milk-Frother-and-Grinder-17.3-x-7.4-x-12.5/43154746/product.html",
      "method": "web.open",
      "retrieved_at": "2026-09-13T10:55:26.513Z",
      "status": "page_text_returned"
    },
    {
      "url": "https://www.bedbathandbeyond.com/Home-Garden/20-Bar-Automatic-Espresso-Coffee-Machine-with-Milk-Frother-and-Grinder-17.3-x-7.4-x-12.5/43154746/product.html",
      "method": "web.search exact-URL product document",
      "retrieved_at": "2026-09-13T10:59:02.853Z",
      "status": "page_text_returned"
    }
  ],
  "limits": [
    "Page-supported claims, not independent physical testing.",
    "Missing facts mean unknown, not absent.",
    "Frozen price and merchant text remain in the recommendation record; current observations do not replace them."
  ]
}
