{
  "schema_version": "1.0.0",
  "facts_version": "1.0.0",
  "scenario_version": "1.3.0",
  "record_id": "google-e9dba9582661875ea431",
  "provider": "google",
  "frozen_record_sha256": "e9dba9582661875ea431be2617cd7ebf0887c3243dab6d8119066f9e197222b2",
  "frozen_title": "Professional Espresso Machine with Integrated Grinder & Auto Milk Frother, 20 Bar Pump for Lattes and Cappuccinos at Home, Silver",
  "resolution": {
    "status": "matched_listing",
    "token_overlap": 1.0,
    "reasons": [],
    "method": "title_and_merchant_search_candidate",
    "page_title": "Professional Espresso Machine with Integrated Grinder & Auto Milk Frother, 20 Bar Pump for Lattes and Cappuccinos at Home",
    "product_url": "https://www.walmart.com/ip/18598472349",
    "note": "Matched using product title and retained URL lineage or merchant-scoped search; not independently verified SKU identity."
  },
  "facts": [
    {
      "category": "grinding",
      "name": "integrated_grinder",
      "value": true,
      "evidence": [
        {
          "source_id": "src-98df27337b98a2978d96398c",
          "locator": "page title"
        }
      ]
    },
    {
      "category": "milk",
      "name": "automatic_frothing_explicit",
      "value": true,
      "evidence": [
        {
          "source_id": "src-98df27337b98a2978d96398c",
          "locator": "page title"
        }
      ]
    },
    {
      "category": "brewing",
      "name": "pump_pressure_bar",
      "value": "20",
      "evidence": [
        {
          "source_id": "src-98df27337b98a2978d96398c",
          "locator": "page title"
        }
      ],
      "unit": "bar"
    },
    {
      "category": "brewing",
      "name": "pid_temperature_control",
      "value": true,
      "evidence": [
        {
          "source_id": "src-98df27337b98a2978d96398c",
          "locator": "web text line 293"
        }
      ]
    }
  ],
  "offer_observations": [],
  "conflicts": [],
  "not_established_categories": [
    "electrical",
    "included_items",
    "maintenance",
    "physical"
  ],
  "attempts": [
    {
      "method": "web.search title and merchant domain",
      "query": "Professional Espresso Machine with Integrated Grinder & Auto Milk Frother, 20 Bar Pump for Lattes and Cappuccinos at Home, Silver",
      "domain_filter": "walmart.com",
      "retrieved_at": "2026-09-13T10:42:40.279Z",
      "candidate_count": 12,
      "status": "URL discovery only; no search snippet treated as a fact"
    },
    {
      "url": "https://www.walmart.com/ip/18598472349",
      "method": "HTTP GET",
      "retrieved_at": "2026-09-13T10:49:16.920272+00:00",
      "status": "retrieved",
      "http_status": 200
    },
    {
      "url": "https://www.walmart.com/ip/18598472349",
      "method": "web.open",
      "retrieved_at": "2026-09-13T10:55:52.211Z",
      "status": "page_text_returned"
    }
  ],
  "limits": [
    "Page-supported claims, not independent physical testing.",
    "Missing facts mean unknown, not absent.",
    "Frozen price and merchant text remain in the recommendation record; current observations do not replace them."
  ]
}
