{
  "schema_version": "1.0.0",
  "facts_version": "1.0.0",
  "scenario_version": "1.3.0",
  "record_id": "google-9083303fcc2e5fd2dd1d",
  "provider": "google",
  "frozen_record_sha256": "9083303fcc2e5fd2dd1db27ff622f630b1fc69eef4c09ceb3bf548aa567ba007",
  "frozen_title": "Delonghi Magnifica Evo with frother ECAM29084SB | 2 Yrs Warranty",
  "resolution": {
    "status": "matched_listing",
    "token_overlap": 1.0,
    "reasons": [],
    "method": "title_and_merchant_search_candidate",
    "page_title": "Delonghi Magnifica Evo with frother ECAM29084SB | 2 Yrs Warranty",
    "product_url": "https://espresso-experts.com/collections/fully-automatic-espresso-machines/products/delonghi-magnifica-evo-with-frother-ecam29084sb-2-yrs-warranty",
    "note": "Matched using product title and retained URL lineage or merchant-scoped search; not independently verified SKU identity."
  },
  "facts": [
    {
      "category": "grinding",
      "name": "integrated_grinder",
      "value": true,
      "evidence": [
        {
          "source_id": "src-1eef38ba3a8027e4487bb793",
          "locator": "script[type=\"application/ld+json\"] index 1; $.description"
        },
        {
          "source_id": "src-c718c20c2eb991a36f230d26",
          "locator": "web text line 173"
        }
      ]
    },
    {
      "category": "grinding",
      "name": "burr_type",
      "value": "conical",
      "evidence": [
        {
          "source_id": "src-1eef38ba3a8027e4487bb793",
          "locator": "script[type=\"application/ld+json\"] index 1; $.description"
        },
        {
          "source_id": "src-c718c20c2eb991a36f230d26",
          "locator": "web text line 173"
        }
      ]
    },
    {
      "category": "milk",
      "name": "automatic_frothing_explicit",
      "value": true,
      "evidence": [
        {
          "source_id": "src-1eef38ba3a8027e4487bb793",
          "locator": "script[type=\"application/ld+json\"] index 1; $.description"
        },
        {
          "source_id": "src-c718c20c2eb991a36f230d26",
          "locator": "web text line 172"
        }
      ]
    },
    {
      "category": "maintenance",
      "name": "self_cleaning_claim",
      "value": true,
      "evidence": [
        {
          "source_id": "src-1eef38ba3a8027e4487bb793",
          "locator": "script[type=\"application/ld+json\"] index 1; $.description"
        },
        {
          "source_id": "src-c718c20c2eb991a36f230d26",
          "locator": "web text line 173"
        }
      ]
    },
    {
      "category": "maintenance",
      "name": "removable_brew_unit",
      "value": true,
      "evidence": [
        {
          "source_id": "src-1eef38ba3a8027e4487bb793",
          "locator": "script[type=\"application/ld+json\"] index 1; $.description"
        }
      ]
    },
    {
      "category": "physical",
      "name": "removable_water_tank",
      "value": true,
      "evidence": [
        {
          "source_id": "src-1eef38ba3a8027e4487bb793",
          "locator": "script[type=\"application/ld+json\"] index 1; $.description"
        },
        {
          "source_id": "src-c718c20c2eb991a36f230d26",
          "locator": "web text line 248"
        }
      ]
    },
    {
      "category": "grinding",
      "name": "grind_settings",
      "value": "13",
      "evidence": [
        {
          "source_id": "src-1eef38ba3a8027e4487bb793",
          "locator": "script[type=\"application/ld+json\"] index 1; $.description"
        },
        {
          "source_id": "src-c718c20c2eb991a36f230d26",
          "locator": "web text line 186"
        }
      ]
    },
    {
      "category": "electrical",
      "name": "power",
      "value": "1450",
      "evidence": [
        {
          "source_id": "src-1eef38ba3a8027e4487bb793",
          "locator": "script[type=\"application/ld+json\"] index 1; $.description"
        },
        {
          "source_id": "src-c718c20c2eb991a36f230d26",
          "locator": "web text line 203"
        }
      ],
      "unit": "W"
    },
    {
      "category": "physical",
      "name": "dimensions",
      "value": "(inches)    9.44 x 17.32 x 14.17",
      "evidence": [
        {
          "source_id": "src-1eef38ba3a8027e4487bb793",
          "locator": "script[type=\"application/ld+json\"] index 1; $.description"
        },
        {
          "source_id": "src-c718c20c2eb991a36f230d26",
          "locator": "web text line 193"
        }
      ]
    },
    {
      "category": "identity",
      "name": "sku",
      "value": "9961",
      "evidence": [
        {
          "source_id": "src-1eef38ba3a8027e4487bb793",
          "locator": "script[type=\"application/ld+json\"] index 1; $.sku"
        }
      ]
    },
    {
      "category": "physical",
      "name": "dimensions",
      "value": "(in./mm)  | 360x240x440mm",
      "evidence": [
        {
          "source_id": "src-c718c20c2eb991a36f230d26",
          "locator": "web text line 271"
        }
      ]
    }
  ],
  "offer_observations": [
    {
      "observations": {
        "price": 899.95,
        "priceCurrency": "USD",
        "availability": "http://schema.org/InStock",
        "sku": "9961"
      },
      "scope": "landing-page offer; may differ from original frozen seller/variant",
      "source_id": "src-1eef38ba3a8027e4487bb793",
      "locator": "script[type=\"application/ld+json\"] index 1; $.offers[0]"
    }
  ],
  "conflicts": [],
  "not_established_categories": [
    "included_items"
  ],
  "attempts": [
    {
      "method": "web.search title and merchant domain",
      "query": "Delonghi Magnifica Evo with frother ECAM29084SB | 2 Yrs Warranty",
      "domain_filter": "espresso-experts.com",
      "retrieved_at": "2026-09-13T10:40:09.065Z",
      "candidate_count": 12,
      "status": "URL discovery only; no search snippet treated as a fact"
    },
    {
      "url": "https://espresso-experts.com/collections/fully-automatic-espresso-machines/products/delonghi-magnifica-evo-with-frother-ecam29084sb-2-yrs-warranty",
      "method": "HTTP GET",
      "retrieved_at": "2026-09-13T10:48:27.790549+00:00",
      "status": "retrieved",
      "http_status": 200
    },
    {
      "url": "https://espresso-experts.com/collections/fully-automatic-espresso-machines/products/delonghi-magnifica-evo-with-frother-ecam29084sb-2-yrs-warranty",
      "method": "web.open",
      "retrieved_at": "2026-09-13T10:50:17.198Z",
      "status": "page_text_returned"
    }
  ],
  "limits": [
    "Page-supported claims, not independent physical testing.",
    "Missing facts mean unknown, not absent.",
    "Frozen price and merchant text remain in the recommendation record; current observations do not replace them."
  ]
}
