{
  "schema_version": "1.0.0",
  "facts_version": "1.0.0",
  "scenario_version": "1.3.0",
  "record_id": "bing-a75dd746990e219179ad",
  "provider": "bing",
  "frozen_record_sha256": "a75dd746990e219179ada6c231206d0e03d846ff9d89695bf4345d2f79c8a77c",
  "frozen_title": "Espresso Machine With Grinder Semi-Automatic Espresso Coffee Maker Milk Frother",
  "resolution": {
    "status": "unavailable",
    "method": "retained_bing_product_url_to_selected_merchant",
    "candidate_url": "https://accessoryz.com/products/espresso-machine-with-grinder-semi-automatic-espresso-coffee-maker-milk-frother-36921889cffa3ceae19e448fc1acc16152fd2cb5",
    "reasons": [
      "Product page could not be retrieved with usable, scoped product details."
    ]
  },
  "facts": [],
  "offer_observations": [],
  "conflicts": [],
  "not_established_categories": [
    "electrical",
    "included_items",
    "maintenance",
    "physical",
    "milk",
    "grinding"
  ],
  "attempts": [
    {
      "url": "https://www.bing.com/shop/productdetails?goid=468920804822",
      "retrieved_at": "2026-09-13T10:37:58.620987+00:00",
      "method": "HTTP GET",
      "status": "retrieved",
      "http_status": 200
    },
    {
      "url": "https://accessoryz.com/products/espresso-machine-with-grinder-semi-automatic-espresso-coffee-maker-milk-frother-36921889cffa3ceae19e448fc1acc16152fd2cb5",
      "method": "HTTP GET",
      "retrieved_at": "2026-09-13T10:48:25.894887+00:00",
      "status": "retrieved",
      "http_status": 200
    },
    {
      "url": "https://accessoryz.com/products/espresso-machine-with-grinder-semi-automatic-espresso-coffee-maker-milk-frother-36921889cffa3ceae19e448fc1acc16152fd2cb5",
      "method": "web.open",
      "retrieved_at": "2026-09-13T10:50:11.079Z",
      "status": "unavailable"
    }
  ],
  "limits": [
    "Page-supported claims, not independent physical testing.",
    "Missing facts mean unknown, not absent.",
    "Frozen price and merchant text remain in the recommendation record; current observations do not replace them."
  ]
}
