{
  "schema_version": "1.0.0",
  "facts_version": "1.0.0",
  "scenario_version": "1.3.0",
  "record_id": "google-01649c5aaee6ce640d89",
  "provider": "google",
  "frozen_record_sha256": "01649c5aaee6ce640d893837b8c257ed1a4e39ae4a55ed6fcab72a22762322cc",
  "frozen_title": "Garvee All-in-One Espresso Machine with Milk Frother Cappuccino Latte Coffee Maker for Home Barista",
  "resolution": {
    "status": "unavailable",
    "method": "title_and_merchant_search_candidate",
    "candidate_url": "https://www.garvee.com/collections/new/products/garvee-espresso-machine-coffee-maker-pst-02tzn2nu",
    "reasons": [
      "Product page could not be retrieved with usable, scoped product details."
    ]
  },
  "facts": [],
  "offer_observations": [],
  "conflicts": [],
  "not_established_categories": [
    "electrical",
    "included_items",
    "maintenance",
    "physical",
    "milk",
    "grinding"
  ],
  "attempts": [
    {
      "method": "web.search title and merchant domain",
      "query": "Garvee All-in-One Espresso Machine with Milk Frother Cappuccino Latte Coffee Maker for Home Barista",
      "domain_filter": "garvee.com",
      "retrieved_at": "2026-09-13T10:42:35.390Z",
      "candidate_count": 12,
      "status": "URL discovery only; no search snippet treated as a fact"
    },
    {
      "url": "https://www.garvee.com/collections/new/products/garvee-espresso-machine-coffee-maker-pst-02tzn2nu",
      "method": "HTTP GET",
      "retrieved_at": "2026-09-13T10:49:09.990328+00:00",
      "status": "unavailable",
      "error_type": "HTTPError"
    },
    {
      "url": "https://www.garvee.com/collections/new/products/garvee-espresso-machine-coffee-maker-pst-02tzn2nu",
      "method": "web.open",
      "retrieved_at": "2026-09-13T10:51:06.813Z",
      "status": "unavailable"
    },
    {
      "url": "https://www.garvee.com/collections/new/products/garvee-espresso-machine-coffee-maker-pst-02tzn2nu",
      "method": "web.search matched-URL product document",
      "retrieved_at": "2026-09-13T10:59:08.735Z",
      "status": "page_text_returned"
    }
  ],
  "limits": [
    "Page-supported claims, not independent physical testing.",
    "Missing facts mean unknown, not absent.",
    "Frozen price and merchant text remain in the recommendation record; current observations do not replace them."
  ]
}
