{
  "schema_version": "1.0.0",
  "facts_version": "1.0.0",
  "scenario_version": "1.3.0",
  "record_id": "bing-77ffa67c181d6c3612d6",
  "provider": "bing",
  "frozen_record_sha256": "77ffa67c181d6c3612d625a2755b2f211ced1e1352f71f96001a1af0c9cbb7aa",
  "frozen_title": "Espresso Coffee Machine With Grinder 20 Bar For Home Office Milk Frother Cappuccino Latte Machines Professional",
  "resolution": {
    "status": "unavailable",
    "method": "retained_bing_product_url_to_selected_merchant",
    "candidate_url": "https://www.alibaba.com/pla/Espresso+Coffee+Machine+with+Grinder+20+Bar+for+Home+Office+Milk+Frother+Cappuccino+Latte+Machines+Professional_1601304246207.html?product_id=1601304246207",
    "reasons": [
      "Product page could not be retrieved with usable, scoped product details."
    ]
  },
  "facts": [],
  "offer_observations": [],
  "conflicts": [],
  "not_established_categories": [
    "electrical",
    "included_items",
    "maintenance",
    "physical",
    "milk",
    "grinding"
  ],
  "attempts": [
    {
      "url": "https://www.bing.com/shop/productdetails?goid=361356181023",
      "retrieved_at": "2026-09-13T10:37:54.112850+00:00",
      "method": "HTTP GET",
      "status": "retrieved",
      "http_status": 200
    },
    {
      "url": "https://www.alibaba.com/pla/Espresso+Coffee+Machine+with+Grinder+20+Bar+for+Home+Office+Milk+Frother+Cappuccino+Latte+Machines+Professional_1601304246207.html?product_id=1601304246207",
      "method": "HTTP GET",
      "retrieved_at": "2026-09-13T10:48:31.536930+00:00",
      "status": "retrieved",
      "http_status": 200
    },
    {
      "url": "https://www.alibaba.com/pla/Espresso+Coffee+Machine+with+Grinder+20+Bar+for+Home+Office+Milk+Frother+Cappuccino+Latte+Machines+Professional_1601304246207.html?product_id=1601304246207",
      "method": "web.open",
      "retrieved_at": "2026-09-13T10:50:39.808Z",
      "status": "unavailable"
    }
  ],
  "limits": [
    "Page-supported claims, not independent physical testing.",
    "Missing facts mean unknown, not absent.",
    "Frozen price and merchant text remain in the recommendation record; current observations do not replace them."
  ]
}
