{
  "schema_version": "1.0.0",
  "facts_version": "1.0.0",
  "scenario_version": "1.3.0",
  "record_id": "bing-fa4b67e72a20363a3a83",
  "provider": "bing",
  "frozen_record_sha256": "fa4b67e72a20363a3a83bddd9b46cbde574c138a1e4c651f2eab3ec5da0ab979",
  "frozen_title": "3-In-1 Espresso Machine With Built-In Grinder And Detachable Milk Frother - Adjustable Settings, Removable Components For Home Baristas Yiimo Color/Finish: Silver",
  "resolution": {
    "status": "provider_page_only",
    "method": "retained_bing_product_url_to_selected_merchant",
    "candidate_url": "https://www.wayfair.com/Yiimo--3in1-Espresso-Machine-with-BuiltIn-Grinder-and-Detachable-Milk-Frother-Adjustable-Settings-Removable-Components-for-Home-Baristas-PHO_34Y9_15175_WZX-L914-K~YIIM3171.html",
    "reasons": [
      "Product page could not be retrieved with usable, scoped product details."
    ],
    "merchant_resolution": {
      "status": "unavailable",
      "method": "retained_bing_product_url_to_selected_merchant",
      "candidate_url": "https://www.wayfair.com/Yiimo--3in1-Espresso-Machine-with-BuiltIn-Grinder-and-Detachable-Milk-Frother-Adjustable-Settings-Removable-Components-for-Home-Baristas-PHO_34Y9_15175_WZX-L914-K~YIIM3171.html",
      "reasons": [
        "Product page could not be retrieved with usable, scoped product details."
      ]
    },
    "product_url": "https://www.bing.com/shop/productdetails?goid=387206360656",
    "note": "Only shopping-provider product-page specifications are established; merchant match or access remains unresolved."
  },
  "facts": [
    {
      "category": "provider_specification",
      "name": "Milk Frother",
      "value": "Detachable Frother",
      "evidence": [
        {
          "source_id": "src-16c33506e9dcc95d74d4f5da",
          "locator": "#gpdp-ps li:nth-of-type(1)"
        }
      ]
    },
    {
      "category": "provider_specification",
      "name": "Material",
      "value": "Stainless Steel",
      "evidence": [
        {
          "source_id": "src-16c33506e9dcc95d74d4f5da",
          "locator": "#gpdp-ps li:nth-of-type(2)"
        }
      ]
    },
    {
      "category": "provider_specification",
      "name": "Feature",
      "value": "Built-in Grinder",
      "evidence": [
        {
          "source_id": "src-16c33506e9dcc95d74d4f5da",
          "locator": "#gpdp-ps li:nth-of-type(3)"
        }
      ]
    },
    {
      "category": "provider_specification",
      "name": "Color",
      "value": "Silver",
      "evidence": [
        {
          "source_id": "src-16c33506e9dcc95d74d4f5da",
          "locator": "#gpdp-ps li:nth-of-type(4)"
        }
      ]
    }
  ],
  "offer_observations": [],
  "conflicts": [],
  "not_established_categories": [
    "electrical",
    "included_items",
    "maintenance",
    "physical",
    "milk",
    "grinding"
  ],
  "attempts": [
    {
      "url": "https://www.bing.com/shop/productdetails?goid=387206360656",
      "retrieved_at": "2026-09-13T10:37:39.856115+00:00",
      "method": "HTTP GET",
      "status": "retrieved",
      "http_status": 200
    },
    {
      "url": "https://www.wayfair.com/Yiimo--3in1-Espresso-Machine-with-BuiltIn-Grinder-and-Detachable-Milk-Frother-Adjustable-Settings-Removable-Components-for-Home-Baristas-PHO_34Y9_15175_WZX-L914-K~YIIM3171.html",
      "method": "HTTP GET",
      "retrieved_at": "2026-09-13T10:49:21.035446+00:00",
      "status": "unavailable",
      "error_type": "HTTPError"
    },
    {
      "url": "https://www.wayfair.com/Yiimo--3in1-Espresso-Machine-with-BuiltIn-Grinder-and-Detachable-Milk-Frother-Adjustable-Settings-Removable-Components-for-Home-Baristas-PHO_34Y9_15175_WZX-L914-K~YIIM3171.html",
      "method": "web.open",
      "retrieved_at": "2026-09-13T10:52:16.121Z",
      "status": "unavailable"
    }
  ],
  "limits": [
    "Page-supported claims, not independent physical testing.",
    "Missing facts mean unknown, not absent.",
    "Frozen price and merchant text remain in the recommendation record; current observations do not replace them."
  ]
}
