{
  "schema_version": "1.0.0",
  "facts_version": "1.0.0",
  "scenario_version": "1.3.0",
  "record_id": "bing-8d114b228c5020df8efd",
  "provider": "bing",
  "frozen_record_sha256": "8d114b228c5020df8efda3424207d84efa571a95713240781fb5c864aa59f403",
  "frozen_title": "2025 NEW Stainless Steel Automatic Espresso Coffee Maker With Grinder And Milk Frother Cappuccino With Hot Water System",
  "resolution": {
    "status": "unavailable",
    "method": "retained_bing_product_url_to_selected_merchant",
    "candidate_url": "https://www.alibaba.com/pla/2025+NEW+Stainless+Steel+Automatic+Espresso+Coffee+Maker+With+Grinder+and+Milk+Frother+Cappuccino+with+Hot+Water+System_1601618314641.html?product_id=1601618314641",
    "reasons": [
      "Product page could not be retrieved with usable, scoped product details."
    ]
  },
  "facts": [],
  "offer_observations": [],
  "conflicts": [],
  "not_established_categories": [
    "electrical",
    "included_items",
    "maintenance",
    "physical",
    "milk",
    "grinding"
  ],
  "attempts": [
    {
      "url": "https://www.bing.com/shop/productdetails?goid=389754489993",
      "retrieved_at": "2026-09-13T10:37:37.918744+00:00",
      "method": "HTTP GET",
      "status": "retrieved",
      "http_status": 200
    },
    {
      "url": "https://www.alibaba.com/pla/2025+NEW+Stainless+Steel+Automatic+Espresso+Coffee+Maker+With+Grinder+and+Milk+Frother+Cappuccino+with+Hot+Water+System_1601618314641.html?product_id=1601618314641",
      "method": "HTTP GET",
      "retrieved_at": "2026-09-13T10:48:31.076681+00:00",
      "status": "retrieved",
      "http_status": 200
    },
    {
      "url": "https://www.alibaba.com/pla/2025+NEW+Stainless+Steel+Automatic+Espresso+Coffee+Maker+With+Grinder+and+Milk+Frother+Cappuccino+with+Hot+Water+System_1601618314641.html?product_id=1601618314641",
      "method": "web.open",
      "retrieved_at": "2026-09-13T10:50:36.015Z",
      "status": "unavailable"
    }
  ],
  "limits": [
    "Page-supported claims, not independent physical testing.",
    "Missing facts mean unknown, not absent.",
    "Frozen price and merchant text remain in the recommendation record; current observations do not replace them."
  ]
}
