{
  "schema_version": "1.0.0",
  "facts_version": "1.0.0",
  "scenario_version": "1.3.0",
  "record_id": "google-e6beb424762e82f2edc6",
  "provider": "google",
  "frozen_record_sha256": "e6beb424762e82f2edc6b02027b73bfb07de11b45fa9762cc8a6c2e86e4f484a",
  "frozen_title": "Mooye All-in-One Espresso Machine with Grinder, 20-Bar Espresso Maker with Milk Frother for Latte & Cappuccino, Black",
  "resolution": {
    "status": "matched_listing",
    "token_overlap": 1.0,
    "reasons": [],
    "method": "title_and_merchant_search_candidate",
    "page_title": "Mooye All-in-One Espresso Machine with Grinder, 20-Bar Espresso Maker with Milk Frother for Latte & Cappuccino, Black",
    "product_url": "https://www.walmart.com/ip/20782357690",
    "note": "Matched using product title and retained URL lineage or merchant-scoped search; not independently verified SKU identity."
  },
  "facts": [
    {
      "category": "grinding",
      "name": "integrated_grinder",
      "value": true,
      "evidence": [
        {
          "source_id": "src-47ed0a83b7cf8e8e7d8948e2",
          "locator": "page title"
        }
      ]
    },
    {
      "category": "brewing",
      "name": "extraction_pressure_bar",
      "value": "20",
      "evidence": [
        {
          "source_id": "src-47ed0a83b7cf8e8e7d8948e2",
          "locator": "page title"
        }
      ],
      "unit": "bar"
    },
    {
      "category": "brewing",
      "name": "cold_brew_mode",
      "value": true,
      "evidence": [
        {
          "source_id": "src-47ed0a83b7cf8e8e7d8948e2",
          "locator": "web text line 302"
        }
      ]
    },
    {
      "category": "brewing",
      "name": "advertised_pressure_bar",
      "value": "20",
      "evidence": [
        {
          "source_id": "src-47ed0a83b7cf8e8e7d8948e2",
          "locator": "web text line 303"
        }
      ],
      "unit": "bar"
    },
    {
      "category": "brewing",
      "name": "pump_pressure_bar",
      "value": "20",
      "evidence": [
        {
          "source_id": "src-47ed0a83b7cf8e8e7d8948e2",
          "locator": "web text line 303"
        }
      ],
      "unit": "bar"
    },
    {
      "category": "electrical",
      "name": "power",
      "value": "1350",
      "evidence": [
        {
          "source_id": "src-47ed0a83b7cf8e8e7d8948e2",
          "locator": "web text line 303"
        }
      ],
      "unit": "W"
    },
    {
      "category": "grinding",
      "name": "burr_type",
      "value": "conical",
      "evidence": [
        {
          "source_id": "src-47ed0a83b7cf8e8e7d8948e2",
          "locator": "web text line 304"
        }
      ]
    },
    {
      "category": "grinding",
      "name": "grind_settings",
      "value": "20",
      "evidence": [
        {
          "source_id": "src-47ed0a83b7cf8e8e7d8948e2",
          "locator": "web text line 304"
        }
      ]
    },
    {
      "category": "milk",
      "name": "steam_wand_present",
      "value": true,
      "evidence": [
        {
          "source_id": "src-47ed0a83b7cf8e8e7d8948e2",
          "locator": "web text line 306"
        }
      ]
    }
  ],
  "offer_observations": [],
  "conflicts": [],
  "not_established_categories": [
    "included_items",
    "maintenance",
    "physical"
  ],
  "attempts": [
    {
      "method": "web.search title and merchant domain",
      "query": "Mooye All-in-One Espresso Machine with Grinder, 20-Bar Espresso Maker with Milk Frother for Latte & Cappuccino, Black",
      "domain_filter": "walmart.com",
      "retrieved_at": "2026-09-13T10:40:20.842Z",
      "candidate_count": 12,
      "status": "URL discovery only; no search snippet treated as a fact"
    },
    {
      "url": "https://www.walmart.com/ip/20782357690",
      "method": "HTTP GET",
      "retrieved_at": "2026-09-13T10:49:18.388023+00:00",
      "status": "retrieved",
      "http_status": 200
    },
    {
      "url": "https://www.walmart.com/ip/20782357690",
      "method": "web.open",
      "retrieved_at": "2026-09-13T10:55:30.858Z",
      "status": "page_text_returned"
    }
  ],
  "limits": [
    "Page-supported claims, not independent physical testing.",
    "Missing facts mean unknown, not absent.",
    "Frozen price and merchant text remain in the recommendation record; current observations do not replace them."
  ]
}
